{
  "version": "1.0",
  "style_playbook": "custom: gold-high-water-marks",
  "scenes": [
    {
      "id": "sc01",
      "type": "text_card",
      "description": "主体：一句像随口聊天的‘最近黄金这走势，还挺有意思的。’骨白小字先出现，旁边是一枚尚未启动的旧金价格刻度。场景：黑曜石底、轻微纸张颗粒；原生Remotion文字，不使用模板组件。相机：N/A，原生二维构图。",
      "start_seconds": 0,
      "end_seconds": 5,
      "script_section_id": "s1",
      "framing": "6列竖屏网格，文字偏左下，价格刻度偏右上；大面积留黑。",
      "movement": "文字像聊天气泡一样轻落；价格刻度延迟半秒亮起，无弹跳。",
      "transition_in": "hard editorial cut from black",
      "transition_out": "ruler-line extension",
      "overlay_notes": "仅显示原句，不叠加重复字幕；底部小号日期‘2026’。",
      "shot_intent": "先建立真人口语感和观察视角，避免一开场就像数据报告。",
      "narrative_role": "establish_context",
      "information_role": "让观众感觉这是一次当下行情观察。",
      "required_assets": [{"type": "native_text_and_svg", "description": "手写Remotion文字与单一高水位刻度，不调用共享TextCard。", "source": "generate"}]
    },
    {
      "id": "sc02",
      "type": "animation",
      "description": "主体：2026年黄金价格路径。先陡峭冲向1月底历史新高，再在同一坐标中快速下砸到6月底约4000美元，最后缓慢爬回8月两个月高位。场景：黑曜石坐标场，旧金上涨段、风险红下跌段、骨白轴标；相机：N/A，原生SVG全屏数据动画。",
      "start_seconds": 5,
      "end_seconds": 16,
      "script_section_id": "s1",
      "framing": "全屏宽幅折线压进9:16中部，关键日期分置上下，端点占视觉中心。",
      "movement": "路径按旁白三段式绘制；冲高快、下砸有重量、8月回升缓慢；端点不加确认箭头。",
      "transition_in": "ruler-line grows into chart axis",
      "transition_out": "endpoint hold then spatial zoom",
      "overlay_notes": "标签：‘1月底 新高’、‘6月底 ≈ $4,000’、‘8月 两个月高位附近’；注明‘示意按公开市场资料重绘’。",
      "shot_intent": "把选题为什么现在发生讲清楚，同时不预测下一步。",
      "narrative_role": "establish_context",
      "information_role": "观众看见猛涨、急跌、回升的真实三段行情。",
      "hero_moment": true,
      "required_assets": [{"type": "native_svg_chart", "description": "基于2026公开价格节点手写三段式SVG价格路径，轴与标签原生渲染。", "source": "generate"}]
    },
    {
      "id": "sc03",
      "type": "diagram",
      "description": "主体：悬停在高位的买入指针与一座由价格曲线形成的山峰，峰顶问号不是实体山景而是抽象数据轮廓。场景：黑曜石背景，旧金峰线与骨白问句；相机：N/A，二维分层构图。",
      "start_seconds": 16,
      "end_seconds": 22,
      "script_section_id": "s1",
      "framing": "山峰轮廓占下半屏，买入指针位于右侧峰肩，问句居上。",
      "movement": "指针两次轻微靠近后停住；峰顶问号由曲线末端自然卷出。",
      "transition_in": "chart endpoint expands into mountain contour",
      "transition_out": "question mark splits into two paths",
      "overlay_notes": "主文案：‘都涨到这儿了，现在再买，会不会刚好买在山顶？’",
      "shot_intent": "把价格焦虑转成一个可感知但不俗套的空间问题。",
      "narrative_role": "build_tension",
      "information_role": "提出全片观众问题。",
      "required_assets": [{"type": "native_svg_diagram", "description": "价格峰线、悬停指针和问号路径的手写SVG。", "source": "generate"}]
    },
    {
      "id": "sc04",
      "type": "diagram",
      "description": "主体：同一个当前价格端点分出两条未完成路径——继续上涨与反弹后回落，两条线都以省略号结束。场景：左右分屏、不做概率暗示；相机：N/A，原生SVG。",
      "start_seconds": 22,
      "end_seconds": 29,
      "script_section_id": "s2",
      "framing": "端点居中，两条路径分别向右上和右下延伸；上下留出字幕空间。",
      "movement": "两条路径同时生长、同时停在未完成状态，随后整体降到低对比度。",
      "transition_in": "question mark unthreads into two paths",
      "transition_out": "both paths desaturate",
      "overlay_notes": "‘继续涨？’与‘反弹后再跌？’等权显示；中间出现‘谁也猜不准’。",
      "shot_intent": "明确本片不做短期预测。",
      "narrative_role": "build_tension",
      "information_role": "未来路径未知，转而检验历史。",
      "required_assets": [{"type": "native_svg_diagram", "description": "两条等权未完成价格路径与原生文字标签。", "source": "generate"}]
    },
    {
      "id": "sc05",
      "type": "text_card",
      "description": "主体：‘我们总觉得：创新高以后买，很危险。’像一条手写研究笔记压在桌面网格上，‘危险’二字仅以风险红下划线标记。场景：抽象研究笔记，不出现真实纸张照片；相机：N/A。",
      "start_seconds": 29,
      "end_seconds": 34,
      "script_section_id": "s2",
      "framing": "左对齐中近景排版，右侧留一个空白证据栏。",
      "movement": "文字逐行出现；红色下划线最后画出，然后被一个问号打断。",
      "transition_in": "soft opacity lift",
      "transition_out": "note grid stretches into timeline",
      "overlay_notes": "只突出‘创新高以后买’和‘很危险？’，不重复整段旁白。",
      "shot_intent": "保留用户文案中的个人思考，而不是直接宣布研究。",
      "narrative_role": "introduce_subject",
      "information_role": "把普遍直觉变成待验证假设。",
      "required_assets": [{"type": "native_typography", "description": "研究笔记式原生排版与风险红下划线。", "source": "generate"}]
    },
    {
      "id": "sc06",
      "type": "animation",
      "description": "主体：2001—2026长时间尺从远处横向铺开，零散金色历史节点等待被点亮。场景：像精密测量尺而非股票软件；相机：N/A，二维时间空间，模拟缓慢横移。",
      "start_seconds": 34,
      "end_seconds": 41,
      "script_section_id": "s2",
      "framing": "时间尺从画面左下延伸至右上，年份分层形成深度错觉。",
      "movement": "从2026端点平稳回溯到2001，年份掠过但保持可读。",
      "transition_in": "note grid stretches into calibrated ruler",
      "transition_out": "ruler locks at 2001",
      "overlay_notes": "‘过去二十多年’作为小标题；不显示宏观新闻。",
      "shot_intent": "把‘翻历史’变成视觉上的真实回溯动作。",
      "narrative_role": "transition",
      "information_role": "进入历史回测世界。",
      "required_assets": [{"type": "native_timeline", "description": "2001—2026校准时间尺与年份刻度。", "source": "generate"}]
    },
    {
      "id": "sc07",
      "type": "diagram",
      "description": "主体：某日价格越过此前最高水平，形成一次清晰的新高事件。场景：只展示三根抽象日度价格针与一条历史高水位线；相机：N/A。",
      "start_seconds": 41,
      "end_seconds": 49,
      "script_section_id": "s3",
      "framing": "高水位线横穿画面中上部，突破日价格针居中放大。",
      "movement": "此前价格停在水位下方；当天针越线后旧金锁定，标签‘新高’出现。",
      "transition_in": "2001 ruler becomes horizontal baseline",
      "transition_out": "breakout marker advances one trading day",
      "overlay_notes": "原生标签：‘当天价格 > 此前所有日度价格’。",
      "shot_intent": "用一个具体画面讲清新高定义。",
      "narrative_role": "deliver_payload",
      "information_role": "观众理解什么被算作一次新高。",
      "required_assets": [{"type": "native_svg_diagram", "description": "历史高水位、日度价格针和突破事件。", "source": "generate"}]
    },
    {
      "id": "sc08",
      "type": "animation",
      "description": "主体：T日新高刻度向右移动到T+1买入，再向外展开1个月、3个月、6个月、1年四个观察窗。场景：精密时间标尺；相机：N/A。",
      "start_seconds": 49,
      "end_seconds": 57,
      "script_section_id": "s3",
      "framing": "T与T+1在上半屏，四个持有期在下半屏扇形展开。",
      "movement": "买入指针从T跳到T+1；四个窗口依次延展并锁定。",
      "transition_in": "breakout marker slides right",
      "transition_out": "four windows collapse into event dots",
      "overlay_notes": "标签：‘下一个交易日买入’、‘1月 / 3月 / 6月 / 1年’。",
      "shot_intent": "交代持有期，不让规则只停留在口头。",
      "narrative_role": "deliver_payload",
      "information_role": "观众理解每个结果从哪里来。",
      "required_assets": [{"type": "native_timeline_animation", "description": "T、T+1和四个持有窗口的原生时间动画。", "source": "generate"}]
    },
    {
      "id": "sc09",
      "type": "text_card",
      "description": "主体：199个微小金点组成一个巨大的‘199’，旁边先出现‘可能会挺难看’，随后风险红阴影退去，露出‘结果还真不是’。场景：数字雕塑式构图；相机：N/A。",
      "start_seconds": 57,
      "end_seconds": 65,
      "script_section_id": "s3",
      "framing": "199占画面中央，文字分置上下，点阵细节清晰。",
      "movement": "199点阵聚合；红色阴影短暂覆盖再退去；最后一句轻落。",
      "transition_in": "holding windows collapse into 199 dots",
      "transition_out": "dots redistribute into probability field",
      "overlay_notes": "显示‘199个新高日’；不加胜负表情或夸张音效。",
      "shot_intent": "承接用户文案的真实预期并制造第一处结果悬念。",
      "narrative_role": "build_tension",
      "information_role": "样本规模与预期反转。",
      "required_assets": [{"type": "native_particle_typography", "description": "由199个可计数金点组成的数字199。", "source": "generate"}]
    },
    {
      "id": "sc10",
      "type": "animation",
      "description": "主体：半年观察窗内，199个样本点按正负结果分列，77.4%金色区域逐步填满。场景：概率场而非通用进度条；相机：N/A。",
      "start_seconds": 65,
      "end_seconds": 72,
      "script_section_id": "s4",
      "framing": "样本点矩阵占中部，77.4%作为右上大号数，‘半年’固定左上。",
      "movement": "点阵按结果归位，金色正收益区从左至右形成；未成熟样本不出现。",
      "transition_in": "199 numeral dissolves into sample matrix",
      "transition_out": "matrix rotates to one-year horizon",
      "overlay_notes": "‘半年｜成熟样本｜正收益 77.4%’完整同屏。",
      "shot_intent": "让77.4%来自可见样本，而不是孤立大字。",
      "narrative_role": "evidence",
      "information_role": "半年新高买入的历史正收益比例。",
      "required_assets": [{"type": "native_data_animation", "description": "半年成熟样本的正负点阵与77.4%计数。", "source": "generate"}]
    },
    {
      "id": "sc11",
      "type": "diagram",
      "description": "主体：一年视窗像一把透明测量框覆盖事件点，框内163个成熟样本被确认，76.1%金色点亮。场景：测量仪器感；相机：N/A。",
      "start_seconds": 72,
      "end_seconds": 79,
      "script_section_id": "s4",
      "framing": "透明一年框居中，n=163贴近框角，76.1%置于框内主视觉位置。",
      "movement": "一年测量框落下，成熟样本被扫描确认，比例随扫描计数。",
      "transition_in": "half-year matrix folds into one-year frame",
      "transition_out": "frame opens into return distribution",
      "overlay_notes": "‘一年｜n=163｜正收益 76.1%’。",
      "shot_intent": "把成熟样本数与概率绑定，防止只记住百分比。",
      "narrative_role": "evidence",
      "information_role": "一年样本量与胜率。",
      "required_assets": [{"type": "native_svg_measurement", "description": "一年测量框、成熟样本扫描和76.1%计数。", "source": "generate"}]
    },
    {
      "id": "sc12",
      "type": "text_card",
      "description": "主体：23.8%作为一枚沉稳的旧金数值悬在收益分布上方，旁边保留‘一年平均收益’和‘至少历史上看’。场景：不做庆祝性上涨箭头；相机：N/A。",
      "start_seconds": 79,
      "end_seconds": 87,
      "script_section_id": "s4",
      "framing": "23.8%居中偏上，分布轮廓在下，限定语居左下。",
      "movement": "收益分布从左右展开，平均值落在对应位置；结论句缓慢浮现。",
      "transition_in": "one-year frame opens into distribution",
      "transition_out": "average marker becomes comparison divider",
      "overlay_notes": "‘平均 ≠ 每一次结果’以极小研究批注出现；主句为‘好像并没有想象中那么可怕’。",
      "shot_intent": "交付第一层反直觉结果，同时保留语气边界。",
      "narrative_role": "emotional_beat",
      "information_role": "一年平均收益与有限结论。",
      "required_assets": [{"type": "native_typography_distribution", "description": "23.8%原生数值、收益分布轮廓和限定语。", "source": "generate"}]
    },
    {
      "id": "sc13",
      "type": "diagram",
      "description": "主体：一枚普通日抽样指针闭眼落在长时间轴任意位置，与新高日指针形成两种买入条件。场景：左普通日、右新高日；相机：N/A。",
      "start_seconds": 87,
      "end_seconds": 95,
      "script_section_id": "s5",
      "framing": "上下双轨时间轴，普通日轨道更密，新高日轨道仅标记峰值。",
      "movement": "普通日指针随机但确定性地落位；新高日指针锁到峰值；两轨对齐一年窗口。",
      "transition_in": "average marker stretches into divider",
      "transition_out": "two tracks rotate upright",
      "overlay_notes": "‘普通交易日’与‘新高日’等权标签。",
      "shot_intent": "让普通日对照的规则直观可见。",
      "narrative_role": "comparison",